<?xml version="1.0" encoding="UTF-8"?>
<!-- =====================================================================================

             Holodeck B2B Default Security Provider Configuration

This file configures the access to the keystores used by the default security
provider to store the key pairs and certificates needed in the processing of the
messages. The default provider uses three keystores which contain the keys
and certificates needed in specific actions:
 * The key pairs used for signing and decryption of messages.
 * The certificates with public keys used for encryption of messages.
 * The certificates with public keys used for the verification of a
   message's signature.
===================================================================================== -->
<ProviderConfiguration xmlns="http://holodeck-b2b.org/schemas/2017/10/config/security"
 xmlns:xsi="http://www.w3.org/2001/XMLSchema-instance"
 xsi:schemaLocation="http://holodeck-b2b.org/schemas/2017/10/config/security ../repository/xsd/hb2b-security-cfg.xsd">
    <Keystores>
        <PrivateKeys>
            <Path>repository/certs/privatekeys.jks</Path>
            <Password>secrets</Password>
        </PrivateKeys>
        <PublicEncryptionKeys>
            <Path>repository/certs/encryptionkeys.jks</Path>
            <Password>nosecrets</Password>
        </PublicEncryptionKeys>
        <TrustedCerts>
            <Path>repository/certs/trustedcerts.jks</Path>
            <Password>trusted</Password>
        </TrustedCerts>
    </Keystores>
</ProviderConfiguration>
