<?xml version="1.0" encoding="UTF-8"?>
<ProviderConfiguration xmlns="http://holodeck-b2b.org/schemas/2017/10/config/security"
 xmlns:xsi="http://www.w3.org/2001/XMLSchema-instance"
 xsi:schemaLocation="http://holodeck-b2b.org/schemas/2017/10/config/security file:/Users/safi/Development/hb2b-cur-dev/modules/holodeckb2b-security/src/main/resources/hb2b-security-cfg.xsd">
    <Keystores>
        <PrivateKeys>
            <Path>privatekeys.jks</Path>
            <Password>secrets</Password>
        </PrivateKeys>
        <PublicEncryptionKeys>
            <Path>encryptionkeys.jks</Path>
            <Password>nosecrets</Password>
        </PublicEncryptionKeys>
        <TrustedCerts>
            <Path>trustedcerts.jks</Path>
            <Password>trusted</Password>
        </TrustedCerts>
    </Keystores>
</ProviderConfiguration>
